ID,Term,Topic #1,Topic #2,Topic #3,Topic #4,Synonym #1,Synonym #2,Synonym #3,Synonym #4,Synonym #5,Synonym #6,Synonym #7,Synonym #8,Synonym #9,Synonym #10,Synonym #11,Synonym #12,Definition #1,Definition #2,Definition #3,Definition #4
6523,microfinance,Environmental Governance,,,,,,,,,,,,,,,,"Microfinance is the provision of a set of financial products to the poor who are excluded from the formal financial system. It includes savings, insurance and money transfer services, financial products adapted to the needs and realities of poor people (draft from various sources incl. Wikipedia).",,,
6335,subsidy,Environmental Governance,,,,,,,,,,,,,,,,"Any monetary grant made by the government to an economic sector with the aim of lowering the market price of some service or product and making it readily affordable to the public. (Source: GEMET-MGHME / RHW, edited MMA)",,,
6543,harmful subsidy,Environmental Governance,,,,negative subsidy,disincentive,environmentally harmful subsidy,perversive incentive measure,,,,,,,,,,,,
6334,tax,Environmental Governance,,,,levy,,,,,,,,,,,,"An amount of money demanded by a government for its support or for specific facilities or services, most frequently levied upon income, property or sales. (Source: RHW/ GEMET)",,,
6375,economy in transition,Environmental Governance,,,,transition economy,transitional economy,,,,,,,,,,,"Countries moving from centrally-planned to market-oriented economies. These countries - which include China, Mongolia, Vietnam, former republics of the Soviet Union, and the countries of Central and Eastern Europe - contain about one-third of the world's population. (Source: World Bank)",,,
6238,green economy,Environmental Governance,,,,green growth,sustainable industrialization,,,,,,,,,,,"Green economy results in improved human well-being and social equity, while significantly reducing environmental risks and ecological scarcities. In its simplest expression, a green economy can be thought of as one which is low carbon, resource efficient ans socially inclusive. Practically speaking, a green economy is one whose growth in income and employment is driven by public and private investments that reduce carbon emissions and pollution, enhance energy and resource efficiency, and prevent the loss of biodiversity and ecosystem services. (Source: UNEP Green Economy Initiative) ",Green growth means fostering economic growth and development while ensuring that natural assets continue to provide the resources and environmental services on which our well-being relies. (Source: OECD),,
6530,environmental procurement,Environmental Governance,,,,environmental friendly procurement,green procurement,,,,,,,,,,,The process of obtaining products and services which are favorably disposed toward the environment. (Source: GEMET/RHW),,,
6028,sound environmental management,Environmental Governance,,,,environmentally sound manner,environmentally sound management,environmentally sound co-processing,sustainable production patterns,environmentally sound technology,ESM,,,,,,,The process of establishing a non-destructive relation between human activities and natural systems. (Source: UNEP),,,
6004,sustainable production,Environmental Governance,,,,cleaner production,ecofriendly process,ecofriendly product,resource efficient production,,,,,,,,,"A preventive, company-specific environmental protection initiative. It is intended to minimize waste and emissions and maximize product output.. (Source: Wikipedia)","The continuous application of preventive environmental strategies to processes, products, and services to increase efficiency and reduce risks to humans and the environment. (Source: UNEP, RECP programme)",,
6182,livelihood,Environmental Governance,,,,subsistence,basic necessities,basic needs,alternative livelihood,,,,,,,,,"A livelihood is a means of making a living. It encompasses peoples capabilities, assets, income and activities required to secure the necessities of life. A livelihood is sustainable when it enables people to cope with and recover from shocks and stresses (such as natural disasters and economic or social upheavals) and enhance their well-being and that of future generations without undermining the natural environment or resource base. (Source: International Federation of Red Cross and Red Crescent Societies). Livelihood, or subsistence can be based on traditions that contradict conservation efforts. (compare CMS Art. 5c)",,,
6405,poverty,Environmental Governance,,,,poverty alleviation,poverty eradication,poverty reduction,the poor,,,,,,,,,The State in which an individual lacks the resources necessary for subsistence. (Source: GEMET),,,
6245,ecosystem,Biological diversity,Land and Agriculture,,,,,,,,,,,,,,,A community of organisms and their physical environment interacting as an ecological unit. (Source: GEMET/LBC),"A dynamic complex of plant, animal and micro-organism communities and their non-living environment interacting as a functional unit. (Source: CBD, Article 2) ",,
6332,agro-ecosystem,Biological diversity,Land and Agriculture,,,agroecosystem,,,,,,,,,,,,The organisms and environment of an agricultural area considered as an ecosystem. (Source: FAO),,,
6136,agrobiodiversity,Biological diversity,Land and Agriculture,,,agricultural biodiversity,agricultural biological,,,,,,,,,,,Agricultural biological diversity - or agrobiodiversity for short - includes all components of biological diversity of relevance to food and agriculture and all components of biological diversity that contribute to sustaining the key functions of agro-ecosystems. (Source: GIZ),,,
5993,arid ecosystem,Biological diversity,Land and Agriculture,,,,,,,,,,,,,,,The interacting system of a biological community and its non-living environmental surroundings in a climatic region where the annual precipitation averages less than 10 inches per year. (Source: GEMET/ TOE / DOE),,,
6252,biomass,Biological diversity,Land and Agriculture,,,,,,,,,,,,,,,"Biomass refers [...] to the total weight of all the living things in an ecosystem. However, it has come to refer to the amount of plant and crop material that could be produced in an ecosystem for making biofuels and other raw materials used in industry, for example. (Source: GEMET/WRIGHT)",,,
6443,biome,Biological diversity,,,,,,,,,,,,,,,,"A distinct ecological region chacterized by its climate, major biological community and dominat vegetation. Terrestrial biomes include: grassland, tundra, desert, tropical rainforest, and deciduous and confierous forests. (draft: AAM) ","A major portion of the living environment of a particular region (such as a fir forest or grassland), characterised by its distinctive vegetation and maintained largely by local climatic conditions. (Source: CBD) ",,
6438,coastal ecosystem,Biological diversity,Marine and Freshwater,Land and Agriculture,Land and Agriculture,,,,,,,,,,,,,"Marine environments bounded by the coastal land margin (seashore) and the continental shelf 100-200 m below sea level. Ecologically, the coastal and nearshore zones grade from shallow water depths, influenced by the adjacent landmass and input from coastal rivers and estuaries, to the continental shelf break, where oceanic processes predominate. Among the unique marine ecosystems associated with coastal and nearshore waterbodies are seaweed-dominated communities, coral reefs and upwellings. (Source: GEMET/PARCOR)",,,
6515,coastal biodiversity,Biological diversity,Marine and Freshwater,Land and Agriculture,Land and Agriculture,,,,,,,,,,,,,"Marine and coastal environments contain diverse habitats that support an abundance of marine life. Life in our seas produces a third of the oxygen that we breathe, offers a valuable source of protein and moderates global climatic change. Some examples of marine and coastal habitats include mangrove forests; coral reefs; sea grass beds; estuaries in coastal areas; hydrothermal vents; and seamounts and soft sediments on the ocean floor a few kilometres below the surface (Source: CBD) ",,,
6033,ecosystem management,Biological diversity,Land and Agriculture,Environmental Governance,Environmental Governance,integerated ecosystem management,,,,,,,,,,,,"Ecosystem management is a process that aims to conserve major ecological services and restore natural resources while meeting the socioeconomic, political and cultural and needs of current and future generations. The principal objective of ecosystem management is the efficient maintenance and ethical use of natural resources. Source: Wikipedia/Lackey, R.T. 'Seven pillars of ecosystem management', Landscape and Urban Planning Vol. 40: p. 21-30.",,,
6429,ecosystem approach,Biological diversity,Marine and Freshwater,Land and Agriculture,Land and Agriculture,ecosystem-based approach,,,,,,,,,,,,"The ecosystem approach is a strategy for the integrated management of land, water and living resources that promotes conservation and sustainable use in an equitable way. (...) It is based on the application of appropriate scientific methodologies focused on levels of biological organization which encompass the essential processes, functions and interactions among organisms and their environment. It recognizes that humans, with their cultural diversity, are an integral component of ecosystems. (Source: CBD)",,,
6268,ecosystem preservation,Biological diversity,Marine and Freshwater,Land and Agriculture,Land and Agriculture,,,,,,,,,,,,,The effort to maintain an intact ecosystem which functions at the same level that it has historically (Source: drafted),,,
6227,ecosystem restoration,Biological diversity,Marine and Freshwater,Environmental Governance,Environmental Governance,ecological restoration,ecosystem rehabilitation,habitat restoration,restoration of habitat,revitalisation,rewilding,,,,,,,"The return of an ecosystem to its original community structure, natural complement of species, and natural functions. (Source: EEA)",,,
6126,ecosystem service,Biological diversity,Marine and Freshwater,Land and Agriculture,Land and Agriculture,ecosystem benefit,environmental goods,environmental service,,,,,,,,,,"The benefits people obtain from ecosystems. These include products obtained from ecosystems (e.g. freshwater, food, fuel, genetic resources, natural medicines, etc.); benefits obtained from the regulation of ecosystem processes ( e.g. water erosion, waste, climate and natural hazards); cultural services (e.g., cultural diversity, educational values, social relations, heritag, etc.) and services that are necessary for the production of other ecosystem services (e.g. primary production, nutrient cycling, and water cycling). (Source: Millenium Ecosystem Assessment, 2005, Island Press, Washington D.C.)",,,
5986,payment for ecosystem service,Biological diversity,Marine and Freshwater,Land and Agriculture,Land and Agriculture,PES,payment for environmental service,,,,,,,,,,,"Any payment arrangements (cash payments, technical or financial assistance, tenure rights, or a share in the benefits generated by watershed protections between those paying for an ecosystem service that is valuable to them or to their constituencies and those who receive  the  payments  and engage  in  meaningful  and  measurable  activities  to secure the sustainable supply of the ecosystem services. (Source: Draft based on Payments for Ecosystem Services, Thomas Greiber, IUCN/2009)",,,
6514,forest ecosystem,Biological diversity,Land and Agriculture,,,,,,,,,,,,,,,"A forest ecosystem is a dynamic complex of plant, animal and micro-organism communities and their abiotic environment interacting as a functional unit, where trees are a key component of the system. Humans, with their cultural, economic and environmental needs, are an integral part of many forest ecosystems. (Source: CBD)",,,
6420,forest biodiversity,Biological diversity,,,,,,,,,,,,,,,,"Any forest environment, in which plants and animals interact with the chemical and physical features of the environment, in which they live. (Source: GEMET/GILP96a)","Forest biological diversity means the variability among forest living organisms and the ecological processes of which they are part; this includes diversity in forests within species, between species and of ecosystems and landscapes (Source: CBD)",,
6274,island ecosystem,Biological diversity,Land and Agriculture,,,archipelago,,,,,,,,,,,,"Unique but fragile and vulnerable ecosystems due to the fact that the evolution of their flora and fauna has taken place in relative isolation. Many remote islands have some of the most unique flora in the world; some have species of plants and animals that are not found anywhere else, which have evolved in a specialized way, sheltered from the fierce competition that species face on mainland. (Source: GEMET/WRIGHT)",,,
6513,island biodiversity,Biological diversity,,,,,,,,,,,,,,,,"Islands and their surrounding near-shore marine areas constitute unique ecosystems often comprising many plant and animal species that are endemic?found nowhere else on Earth. They are also key to the livelihood, economy, well-being and cultural identity of 600 million islanders?one-tenth of world population.
Island species are also unique in their vulnerability: of the 724 recorded animal extinctions in the last 400 years, about half were island species. Over the past century, island biodiversity has been subject to intense pressure from invasive alien species, habitat change and over-exploitation, and, increasingly, from climate change and pollution. This pressure is also keenly felt by island economies. Among the most vulnerable of the developing countries, small island developing States (SIDS) depend on the conservation and sustainable use of island biodiversity for their sustainable development.
(Source: CBD)","Unique but fragile and vulnerable ecosystems due to the fact that the evolution of their flora and fauna has taken place in relative isolation. Many remote islands have some of the most unique flora in the world; some have species of plants and animals that are not found anywhere else, which have evolved in a specialized way, sheltered from the fierce competition that species face on mainland. (Source: GEMET/ WRIGHT)",,
6409,marine ecosystem,Biological diversity,Marine and Freshwater,,,marine environment,ocean ecosystem,,,,,,,,,,,"Any marine environment, from pond to ocean, in which plants and animals interact with the chemical and physical features of the environment. (Source: GEMET/GILP96)",,,
6013,coral reef,Biological diversity,Marine and Freshwater,,,coral bleaching,,,,,,,,,,,,"A wave-resistant structure resulting from cementation processes and the skeletal construction of hermatypic corals, calcareaous algae, and other carbonate-secreting organisms. (Source: NOAA)","Coral reefs are built up from the skeletons of reef-building coral, a small primitive marine animal, and other marine animals and algae over thousands of years [...]. (Source: GEMET/WRIGHT)",,
6512,marine biodiversity,Biological diversity,Marine and Freshwater,,,,,,,,,,,,,,,"The variability among living organisms from all sources, including inter alia , terrestrial, marine and other aquatic ecosystems and the ecological complexes of which they are part; including diversity within species, between species and of ecosystems. (Source: CBD, Art. 2)",,,
6273,mountain ecosystem,Biological diversity,Land and Agriculture,,,montane ecosystem,,,,,,,,,,,,"Ecosystems found on high-mountains at low latitudes. Mountain ecosystems are very vulnerable. They are increasingly sensitive to soil erosion, landslide and rapid loss of habitat and genetic diversity. Widespread poverty and an increase in the numbers of mountain inhabitants lead to deforestation, cultivation of marginal lands, excessive livestock grazing, loss of biomass cover and other forms of environmental degradation. (Source: WRIGHT)",,,
6419,glacier,Climate and Atmosphere,,,,,,,,,,,,,,,,"Slow moving masses of ice which have accumulated either on mountains or in polar regions. They are found where warm, moist air or warm water meets cold air or water. They move, influenced by the force of gravity and the pressure of the ice, above the underlying slush layers and slide downhill, eventually melting at lower levels to form rivers or reaching sea-level, where they form ice shelves or fall into the water as icebergs. (Source: GEMET/WRIGHT)",,,
6511,mountain biodiversity,Biological diversity,,,,,,,,,,,,,,,,"Many mountain ecosystems are host to higher species richness and levels of endemism than adjacent lowlands. Mountains at lower altitudes can support exceptional biodiversity, due to compression of a wide range of ecosystems into a relatively short distance. Mountains also often provide islands of suitable habitat, isolated from unfavourable surrounding lowlands. (Source: CBD)",,,
6406,polar ecosystem,Biological diversity,,,,arctic ecosystem,polar ecology,,,,,,,,,,,"The interacting systems of the biological communities and their nonliving environmental surroundings located in the regions where the air temperature is perennially below 10ø Celsius, usually at and near the North and South Poles. (Source: TOE / DOE / EOC)",,,
6510,polar biodiversity,Biological diversity,,,,arctic biodiversity,,,,,,,,,,,,"The variability among living organism withing the polar ecosystem. Physical characteristics important for structuring Arctic biodiversity include extreme seasonality with dramatic intra-annual variation in insolation, generally cool summers, presence of permafrost resulting in unusual landforms, and annual to multi-year sea-ice cover. (Source: conservation of Arctic Flora and Fauna)",,,
6061,semi-arid ecosystem,Climate and Atmosphere,Biological diversity,Land and Agriculture,Land and Agriculture,,,,,,,,,,,,,The interacting system of a biological community and its non-living environmental surroundings in regions that have between 10 to 20 inches of rainfall and are capable of sustaining some grasses and shrubs but not woodland. (Source: GEMET/TOE / DOE),,,
6509,tropical ecosystem,Biological diversity,,,,,,,,,,,,,,,,The interacting system of a biological community and its non-living environmental surroundings in the land and water of the equatorial region between the Tropic of Cancer and the Tropic of Capricorn. (Source: GEMET/ TOE / ENC),,,
6272,tropical rainforest,Biological diversity,,,,,,,,,,,,,,,,"A vegetation class consisting of tall, close-growing trees, their columnar trunks more or less unbranched in the lower two-thirds, and forming a spreading and frequently flat crown; occurs in areas of high temperature and high rainfall. (Source: GEMET/ MGH)",,,
6148,urban ecosystem,Biological diversity,Land and Agriculture,,,urban area,city,,,,,,,,,,,"Towns and cities viewed as ecosystems, having an input of matter and energy, recycling within the system, and an output of matter and energy into the surroundings. (Source: GEMET/ GILP96)",,,
6299,vulnerable ecosystem,Climate and Atmosphere,Biological diversity,Marine and Freshwater,Marine and Freshwater,,,,,,,,,,,,,"An ecosystem is Vulnerable when the best available evidence indicates that it meets any of the criteria A to E for Vulnerable. It is therefore considered to be at a high risk of collapse (Source: Guidelines for the application of IUCN Red List of Ecosystems Categories and Criteria, 2016)",,,
6508,wetland ecosystem,Biological diversity,Marine and Freshwater,,,wetland biodiveristy,,,,,,,,,,,,"Ecosystems of areas largely inundated with water but offering elevated lands as a habitat for wildlife. This areas include swamps, both seasonal and permanent, marsh, open fresh water, shallow saline lagoons, the estuaries of rivers, floodplains and coastal sand dunes. [...] (Source: GEMET/ GILP96 / WRIGHT)",,,
6271,energy,Climate and Atmosphere,,,,energy production,,,,,,,,,,,,"The capacity to do work; involving thermal energy (heat), radiant energy (light), kinetic energy (motion) or chemical energy; measured in joules. (Source: GEMET/LBC)",,,
6529,conventional energy,Climate and Atmosphere,,,,fossil energy,fossil fuel,,,,,,,,,,,"Power provided by traditional means such as coal, wood, gas, etc., as opposed to alternative energy sources such as solar power, tidal power, wind power, etc. (Source: GEMET/PHC)

",,,
6531,energy efficiency,Climate and Atmosphere,Environmental Governance,,,efficient energy use,,,,,,,,,,,,"Efficient energy use, sometimes simply called energy efficiency, is the goal to reduce the amount of energy required to provide products and services. For example, insulating a home allows a building to use less heating and cooling energy to achieve and maintain a comfortable temperature. Installing fluorescent lights, LED lights or natural skylights reduces the amount of energy required to attain the same level of illumination compared with using traditional incandescent light bulbs. Improvements in energy efficiency are generally achieved by adopting a more efficient technology or production process or by application of commonly accepted methods to reduce energy losses. (Source:Wikipedia)",,,
6534,energy installation,Biological diversity,,,,electrical grid,energy distribution system,electric line,power line,overhead power line,,,,,,,,"Any publicly or privately organized setup in which usable power such as electricity is delivered to homes and businesses. (Source: GEMET/Random House Webster?s Unabridged Dictionary, 1997)",,,
6256,nuclear energy,Climate and Atmosphere,,,,,,,,,,,,,,,,Energy released by nuclear fission or nuclear fusion. (Source: GEMET/MGH),,,
6267,renewable energy,Climate and Atmosphere,,,,alternative energy,clean energy,non-conventional energy,sustainable energy,green power,modern energy,,,,,,,"Energy deriving from sources that do not rely on fuels of which there are only finite stocks. The most widely used renewable source is hydroelectric power; other renewable sources are biomass energy, solar energy, tidal energy, wave energy, and wind energy. (Source: GEMET/UVAROV) ",,,
6253,biofuel,Climate and Atmosphere,Biological diversity,Land and Agriculture,Land and Agriculture,bioenergy,biodiesel,bioethanol,biogas,biomethane,,,,,,,,"A gaseous, liquid, or solid fuel that contains an energy content derived from a biological source.[...] (Source: GEMET/DICCHE)",,,
6507,geothermal energy,Climate and Atmosphere,,,,,,,,,,,,,,,,"An energy produced by tapping the earth's internal heat. At present, the only available technologies to do this are those that extract heat from hydrothermal convection systems, where water or steam transfer the heat from the deeper part of the earth to the areas where the energy can be tapped. The amount of pollutants found in geothermal vary from area to area but may contain arsenic, boron, selenium, lead, cadmium, and fluorides. They also may contain hydrogen sulphide, mercury, ammonia, radon, carbon dioxide, and methane. (Source: GEMET/KOREN)",,,
6285,hydroelectric energy,Climate and Atmosphere,Marine and Freshwater,,,hydropower generation,hydroelectricity,hydropower,hydroelectric energy,,,,,,,,,"The free, renewable source of energy provided by falling water driven through turbines. Hydropower is the most important of the regenerable energy sources because of its highest efficiency at the energy conversion. There are two types of hydroelectric power plants: a) run-of-river power plants for the use of affluent water; b) storage power plants (power stations with reservoir) where the influx can be regulated with the help of a reservoir [...]. (Source: GEMET/PORT / PHC / PZ)",,,
6260,dam,Marine and Freshwater,,,,,,,,,,,,,,,,Structure constructed across a watercourse or stream channel. (Source: GEMET/LANDY),,,
6506,solar energy,Climate and Atmosphere,,,,photovoltaic,photovoltaics,solar,solar power,PV,,,,,,,,The energy transmitted from the sun in the form of electromagnetic radiation. The most successful examples of energy extraction from the sun so far are solar cells and solar collectors used to heat water. (Source: GEMET/MGH / ALL),,,
6505,tidal energy,Climate and Atmosphere,Marine and Freshwater,,,marine current power,marine energy,wave power,tidal power,tidal power station,tidal hydropower,,,,,,,"Mechanical power, which may be converted to electrical power, generated by the rise and fall of ocean tides. Current technology is based on the use of one or more tidal basins, separated from the sea by dams (known as barrages), water passes through hydraulic turbines on its way between the basins and the sea. (Source: GEMET/ALL)",,,
6504,wind energy,Climate and Atmosphere,Land and Agriculture,,,wind power,offshore wind power,wind turbine,,,,,,,,,,"Energy extracted from wind, traditionally in a windmill, but increasingly by more complicated designs including turbines, usually to produce electricity but also for pumping water. (Source: GEMET/BRACK)",,,
6185,environmental damage,Chemicals and Waste,Environmental Governance,,,ecological damage,ecosystem degradation,environmental degradation,environmental depletion,environmental loss,environmental disruption,,,,,,,"Environmental damage or degradation is the deterioration of the environment through depletion of resources such as air, water and soil; the destruction of ecosystems and the extinction of wildlife. It is defined as any change or disturbance to the environment perceived to be deleterious or undesirable. (drafted from Wikipedia)",,,
6541,environmental footprint,Environmental Governance,,,,ecological footprint,carbon footprint,,,,,,,,,,,,,,
