ID,Term,Topic #1,Topic #2,Topic #3,Topic #4,Synonym #1,Synonym #2,Synonym #3,Synonym #4,Synonym #5,Synonym #6,Synonym #7,Synonym #8,Synonym #9,Synonym #10,Synonym #11,Synonym #12,Definition #1,Definition #2,Definition #3,Definition #4
6445,adaptation,Biological diversity,Land and Agriculture,,,adaptation measure,acclimatisation,acclimatization, acclimation,,,,,,,,,"Adjustment in natural or human systems to a new or changing environment.  (Source: IPPC,4th Assessment Report,WG II, Appendix 1, Glossary, 2007)",,,
6165,adverse effect,Chemicals and Waste,,,,adverse impact,hazardous characteristic,harmful impact,harmful effect,,,,,,,,,"Changes in the physical environment or biota, including changes in climate, which have significant deleterious effects on human health or on the composition, resilience or productivity of natural and managed ecosystems, or on materials useful to mankind. (Source: Vienna Convention, Art. 1 Definitions, 1985)",,,
6047,disease,Biological diversity,Land and Agriculture,,,pathogen,pest,crop disease,,,,,,,,,,"1) A definite pathological process having a characteristic set of signs and symptoms which are detrimental to the well-being of the individual. The concept comprises any disease-producing agent or microorganism. (Source: GEMET/KOREN) 2) Any organism that damages crops, injures or irritates livestock or man, or reduces the fertility of land. (Source: GEMET/Koren)",,,
5984,agriculture,Land and Agriculture,,,,,,,,,,,,,,,,"The production of plants and animals useful to man, involving soil cultivation and the breeding and management of crops and livestock. (Source: GEMET/MGH)",,,
6424,agricultural practice,Land and Agriculture,,,,farming practice,farming system,farming technique,,,,,,,,,,"The business, art, or skill of agriculture. (Source: GEMET/CED)",,,
6207,agroforestry,Biological diversity,Land and Agriculture,,,agro-forestry,agro-sylviculture,silvo-pastoralism,,,,,,,,,,"The interplanting of farm crops and trees, especially leguminous species. In semiarid regions and on denuded hillsides, agroforestry helps control erosion and restores soil fertility, as well as supplying valuable food and commodities at the same time. (Source: GEMET/ ALL)",,,
6048,non-timber product,Biological diversity,Land and Agriculture,,,NTFP,,,,,,,,,,,,"Non-timber forest products (NTFPs) are any product or service other than timber that is produced in forests. They include fruits and nuts, vegetables, fish and game, medicinal plants, resins, essences and a range of barks and fibres such as bamboo, rattans, and a host of other palms and grasses. (Source: CIFOR)",,,
6345,cooperative farming,Land and Agriculture,,,,agricultural cooperative,,,,,,,,,,,,"A cooperative is an autonomous association of women and men, who unite voluntarily to meet their common economic, social and cultural needs [...], a business enterprise that seeks to strike a balance between pursuing profit and meeting the needs and interests of members and their communities. Cooperatives [...]. (Source: FAO, Agricultural cooperatives: paving the way for food security and rural development, 2012)",,,
6219,dry farming,Land and Agriculture,,,,arid region agriculture,desert farming,dryland agriculture,arid zone agriculture,,,,,,,,,"A system of extensive agriculture allowing the production of crops without irrigation in areas of limited rainfall. Dry farming involves conserving soil moisture through mulching, frequent fallowing, maintenance of a fine tilth by cross-ploughing, repeated working of the soil after rainfall and removal of any weeds that would take up some of the moisture. (Source: GEMET/GOOD)",,,
6078,intensive farming,Land and Agriculture,,,,extensive farming,factory farming,large scale farming,agricultural intensification,,,,,,,,,Farming in which as much use is made of the land as possible by growing crops close together or by growing several crops in a year or by using large amounts of fertilizers. (Source: GEMET/PHC) ,,,
6181,livestock farming,Land and Agriculture,,,,animal husbandry,pastoralism,ranching,,,,,,,,,,"Breeding of cattle, horses and similar animals. (Source: GEMET/CEDa)",,,
6344,organic farming,Land and Agriculture,,,,ecological farming,,,,,,,,,,,,Farming without the use of industrially made fertilizers or pesticides. (Source: GEMET/ALL) ,,,
6079,overgrazing,Land and Agriculture,,,,,,,,,,,,,,,,"Intensive grazing by animals on an area of land, particularly rangelands and grasslands, such that vegetation is damaged and the soil becomes liable to erosion by wind and rain, sometimes resulting in desertification. The main pressures leading to widespread overgrazing have been the need to increase the size and numbers of domestic herds to produce more food for an increasing human population, and the transformation of traditional pasture land into plantations to grow cash crops. (Source: GEMET/WRIGHT) ",,,
6343,plant production,Land and Agriculture,,,,crop management,crop production,plant cultivation,plant product,plant material,germplasm,cultivated plant,,,,,,The act or process of yielding produce from farmland for livestock or human consumption. (Source: GEMET/RHW / AGP) ,,,
6046,plant protection,Land and Agriculture,,,,plant health,,,,,,,,,,,,"Plant protection is the science and practice of managing pests, diseases and weeds that damage crops and other plants, and which can have a devastating effect on farmer livelihoods. (Source: CABI)",,,
6292,phytosanitary measure,Land and Agriculture,,,,phytosanitary certification,plant pest control,integrated pest control,,,,,,,,,,"Any legislation, regulation or official procedure having the purpose to prevent the introduction or spread of quarantine pests, or to limit the economic impact of regulated non-quarantine pests. (Source: ISPM 4, 1995; revised IPPC, 1997; ICPM, 2002)",,,
6073,plant variety,Land and Agriculture,,,,,,,,,,,,,,,,"'Variety' means a plant grouping, within a single botanical taxon of the lowest known rank, defined by the reproducible expression of its distinguishing and other genetic characteristics. (Source: Art. 2, ITPGRFA)","An assemblage of cultivated plants that are distinguished by any characteristics (morphology, physiology, etc.) significant for purposes of horticulture, agriculture or forestry. (Source: GEMET/DUNSTE)","Within a species there can be a wide range of different types of plant. Farmers and growers need plants with particular characteristics and that are adapted to their environment and their cultivation practices. A plant variety represents a more precisely defined group of plants, selected from within a species, with a common set of characteristics. (Source: UPOV-FAQ)",
6522,small-scale farming,Land and Agriculture,,,,family farming,peasant,smallholder,,,,,,,,,,"Definition variable, e.g.:
- farms ?with a low asset base and operating in less than 2 hectares of cropland? (World Bank Rural Development Strategy, 2003); 
- operating under structural constraints such as access to sub-optimal amounts of resources, technology and markets;
- limited resource endowment compared to those of other farmers in the sector (Dixon et al., 2004);
- struggle to be competitive (?) (Brooks et al., 2009). (Source: Defining small-scale food producers to monitor target 2.3 of the 2030 Agenda for sustainable development, FAO, 2017) ",,,
6183,agroindustry,Land and Agriculture,,,,agricultural industry,livestock industry,,,,,,,,,,,"Industry dealing with the supply, processing and distribution of farm products. (Source: GEMET/PHC)",,,
6114,fertilizer,Chemicals and Waste,Land and Agriculture,,,fertiliser,nutrient,,,,,,,,,,,"Relates to the manufacture and use of fertilizers, nutrients, soil amendments, growth and plant physiology regulators, plant resistance improvers, compost and soil improvers, propagative materials for growing plants, certain agricultural support products, plant nutrients, trace elements, nutritional chemicals, plant inoculants, etc. (Source: Faolex)","Substance added to soil for the purpose of promoting plant life, usually containing nitrogen, potassium and phosphorus, e.g. manure, guano, rock phosphates. (Source: GEMET/BENNET)",,
6145,urban agriculture,Land and Agriculture,,,,,,,,,,,,,,,,The growing of plants and the raising of animals within and around cities. (Source: FAO),,,
5990,air pollution,Climate and Atmosphere,,,,,,,,,,,,,,,,"Presence in the atmosphere of large quantities of gases, solids and radiation produced by the burning of natural and artificial fuels, chemical and other industrial processes and nuclear explosions. (Source: GEMET/ GUNN)",,,
6331,acid precipitation,Climate and Atmosphere,,,,,,,,,,,,,,,,"Rain having a pH less than 5.6. The acidity results from chemical reactions occurring when water, sulphur dioxide, and nitrogen oxides, generally released by industrial processes, are chemically transformed into sulphuric and nitric acids. (Source: GEMET/DUNSTE)",,,
6135,air pollution (non-stationary sources),Climate and Atmosphere,,,,mobile source air pollution,,,,,,,,,,,,"Mobile source air pollution includes any air pollution emitted by motor vehicles, airplanes, locomotives, and other engines and equipment that can be moved from one location to another. (AMM/Wikipedia)",,,
6134,air pollution (stationary sources),Climate and Atmosphere,,,,non-mobile source air pollution,,,,,,,,,,,,"The term stationary source means any [non-mobile] building, structure, facility, or installation which emits or may emit any air pollutant. (Source: 42 U.S. Code Sec. 7411(a)(3))",,,
5991,emission,Climate and Atmosphere,,,,,,,,,,,,,,,,"A discharge of particulate gaseous, or soluble waste material/pollution into the air from a polluting source. (Source: GEMET/UNUN)",The concept refers mainly to the release of greenhouse gases and/or their precursors into the atmosphere over a specified area and period of time. (Source: UNFCCC),,
6008,black carbon,Climate and Atmosphere,,,,aviation emission,navigation emission,,,,,,,,,,,"A distinct type of carbonaceous material, formed only in flames during combustion of carbon-based fuels; physical properties: absorbs visible light; vaporization termperature near 4000K; insoluble in water. (Source: IMO/Bond et al.)",,,
6528,blue carbon,Climate and Atmosphere,Marine and Freshwater,,,,,,,,,,,,,,,"Carbon captured by the world's oceans and coastal ecosystems.The carbon captured by living organisms in oceans is stored in the form of biomass and sediments from mangroves, salt marshes, seagrasses and potentially algae. (Source: GEMET/Wikipedia)",,,
6527,carbon offset,Climate and Atmosphere,,,,carbon compensation,carbon offsetting,,,,,,,,,,,A carbon offset is a reduction in emissions of carbon dioxide or greenhouse gases made in order to compensate for or to offset an emission made elsewhere. (Source: Wikipedia),,,
6291,carbon stock,Climate and Atmosphere,Marine and Freshwater,,,biosequestration,carbon reservoir,carbon sink,,,,,,,,,,A natural reservoir that accumulates and stores some carbon-containing chemical compound for an indefinite period. (Source: Wikipedia),,,
6109,carbon storage,Climate and Atmosphere,,,,CCS,carbon capture,carbon sequestration,,,,,,,,,,"Carbon capture and storage refers to a range of technologies used to capture, transport, and store CO2, that together can be used to reduce the greenhouse gas emissions from fossil fuel power generation and other industrial sources. Credible analyses among clean energy technology projects show that carbon dioxide capture and storage (CCS) may need to play a substantial role in achieving the necessary emissions reductions (Source: http://africanclimate.net/en/node/8506; http://cdm.unfccc.int/about/ccs/index.html)",,,
6261,electro-magnetic pollution,Climate and Atmosphere,,,,electrosmog,electro-magnetic emission,,,,,,,,,,,"Pollution caused by electric and magnetic fields generated by power lines, electrical equipment, mobile and cordless phones, radar, electrical household appliances, microwave ovens, radios, computers, electric clocks, etc. (Source:GEMET/NPLa) ",,,
6124,emission reduction,Climate and Atmosphere,,,,CER,certified emissions reduction,emission reduction targets,greenhouse gas abetement,emission limitation,,,,,,,,"The act or process of limiting or restricting the discharge of pollutants or contaminants, such as by setting emission limits or by modifying the emission source. (Source: GEMET/EEN) ",,,
6160,emission standard,Climate and Atmosphere,,,,emission limit,maximum residue limit,,,,,,,,,,,"The maximum amount of discharge legally allowed from a single source, mobile or stationary. (Source: GEMET/LANDY) ",,,
6106,greenhouse gas,Climate and Atmosphere,,,,GHG,,,,,,,,,,,,"A collective expression for those components of the atmosphere that influence the greenhouse effect, namely carbon dioxide, methane, nitrous oxides, ozone, CFCs and water vapour. (Source: GEMET/GILP96)","A collective term, sometimes abbreviated GHG, used for any atmospheric infrared radiation produced by solar warming of the Earth's surface. They include  carbon dioxide (CO2), methane (CH4), nitrous oxide (NO2), and water vapor. (Source: draft based on Wikipedia)",,
6516,long-range air pollution,Climate and Atmosphere,,,,,,,,,,,,,,,,'Long-range transboundary air pollution' means air pollution whose physical origin is situated wholly or in part within the area under the national jurisdiction of one State and which has adverse effects in the area under the jurisdiction of another State at such a distance that it is not generally possible to distinguish the contribution of individual emission sources or groups of sources (Source: Art.1 1979 Convention on Long-Range Transboundary Air Pollution),,,
6444,air quality,Climate and Atmosphere,,,,,,,,,,,,,,,,The degree to which air is polluted; the type and maximum concentration of man-produced pollutants that should be permitted in the atmosphere. (Source: GEMET/ ALL / WRIGHT),,,
6211,air quality standard,Climate and Atmosphere,,,,,,,,,,,,,,,,"Levels of air pollutants prescribed by regulations that may not be exceeded during a specified time in a defined area. (Source: Glossary of Environment Statistics, Studies in Methods, Series F, No. 67, United Nations, New York, 1997)",,,
6143,anthropocene,Land and Agriculture,Environmental Governance,,,anthropogenic impact,human disturbance,human impact,human activity,,,,,,,,,"Earth has entered the Anthropocene, a new geological epoch in which humans have become a major driver of global environmental change (Source: P.J. Crutzen, 'Geology of Mankind' (2002) 415(6867) Nature, p. 23; et al.)",,,
6187,biodiversity,Biological diversity,,,,biological diversity,species diversity,,,,,,,,,,,"1) Genetic diversity: the variation between individuals and between populations within a species; species diversity: the different types of plants, animals and other life forms within a region; community or ecosystem diversity: the variety of habitats found within an area (grassland, marsh, and woodland for instance. 2) An umbrella term to describe collectively the variety and variability of nature. It encompasses three basic levels of organisation in living systems: the genetic, species, and ecosystem levels. Plant and animal species are the most commonly recognized units of biological diversity, thus public concern has been mainly devoted to conserving species diversity. (Source: GEMET/ WRES / GILP96)",,,
6246,biodiversity hotspot,Biological diversity,,,,key biodiversity area,ecologically significant area,biologically significant area,,,,,,,,,,"A biodiversity hotspot is a region with significant levels of biodiversity that is threatened with destruction. To qualify as a hotspot, a region must meet two criteria: it must contain at least 1,500 species of vascular plants (> 0.5 percent of the world's total) as endemics, and it must have lost at least 70% of its primary vegetation. These sites support nearly 60% of the world's plant, bird, mammal, reptile, and amphibian species, with a very high share of endemic species. One hotspot can include multiple ecoregions. (drafted/ Source: Conservation International)",,,
6342,biodiversity loss,Biological diversity,,,,genetic erosion,,,,,,,,,,,,"Biodiversity loss refers to species' extinctions due to habitat destruction, land conversion for agriculture and development, climate change, pollution, the spread of invasive species and other reasons. (Source: drafted)",,,
6341,biodiversity offset,Biological diversity,,,,habitat bank,,,,,,,,,,,,"Measurable conservation outcomes resulting from actions designed to compensate for significant residual adverse biodiversity impacts arising from project development after appropriate prevention and mitigation measures have been taken.  The goal of biodiversity offsets is to achieve no net loss and preferably a net gain of biodiversity on the ground with respect to species composition, habitat structure, ecosystem function and people's use and cultural values associated with biodiversity. (Source: UNEP/CBD/COP/10/INF/27)",,,
6533,genetic diversity,Biological diversity,Land and Agriculture,,,genetic variability,genetic characteristics,,,,,,,,,,,"Genetic diversity is the total number of genetic characteristics in the genetic makeup of a species. It is distinguished from genetic variability, which describes the tendency of genetic characteristics to vary. (Source: Wikipedia)",,,
6111,genetic resource,Biological diversity,Land and Agriculture,,,,,,,,,,,,,,,"Genetic resources means genetic material of actual or potential value ; genetic  material  means  any  material  of  plant,  animal,  microbial  or  other  origin containing functional units of heredity. (CBD, Article 2)","The gene pool or genetic material in natural and cultivated stocks of organisms of actual or potential value  that are available for human exploitation. It is desirable to maintain as diverse a range of organisms as possible, particularly of domesticated cultivars and their ancestors, in order to maintain a wide genetic base. The wider the genetic base, the greater the capacity for adaptation to particular environmental conditions. (Source: GEMET/ALL2) ",,
6069,access to genetic resources,Biological diversity,,,,,,,,,,,,,,,,"The obtaining and use of genetic resources conserved in situ and ex situ, of their by-products and, if applicable, of their intangible components, for purposes of research, biological prospecting, conservation, industrial application and commercial use, among other things. (Source: WIPO, Andean Community, Decision No. 391 Establishing the Common Regime on Access to Genetic Resources, 1996)",,,
6101,access and benefit sharing,Biological diversity,,,,ABS,access to genetic resources and fair and equitable sharing of benefits,,,,,,,,,,,"According to Article 1 the fair and equitable sharing of the benefits arising out of the utilization of genetic resources, including by appropriate access to genetic resources and by appropriate transfer of relevant technologies, taking into account all rights over those resources and to technologies, and by appropriate funding, including (Art. 8j) the equitable sharing of the benefits arising from the utilization of knowledge, innovations and practices of indigenous and local communities embodying traditional lifestyles relevant for conservation and sustainable use of biological diversity. (Source: Art. 1, Art 8j, CBD)",,,
6499,multilateral system,,,,,,,,,,,,,,,,,"The Contracting Parties of the International Treaty on Plant Genetic Resources for Food and Agriculture agreed ""to establish a multilateral system, which is efficient, effective, and transparent, both to facilitate access to plant genetic resources for food and agriculture, and to share, in a fair and equitable way, the benefits arising from the utilization of these resources, on a complementary and mutually reinforcing basis"". It includes all plant genetic resources for food and agriculture (listed in Annex I) that are under the management and control of the Contracting Parties and in the public domain. (Source: ITPGRFA, Art. 10, 2001)",,,
6236,bioprospecting,Biological diversity,Marine and Freshwater,,,,,,,,,,,,,,,"Bioprospecting is ""the exploration of biodiversity for commercially valuable genetic and biochemical resources (Source: UNEP/CBD/COP/5/INF/7), e.g. of marine environments in regions at extreme depths in the high seas or on the deep seabed for extremophiles, organisms with unique characteristics developed for survival.",,,
6155,genetic resource for food and agriculture,Biological diversity,Land and Agriculture,,,,,,,,,,,,,,,"Any genetic material of plant origin of actual or potential value for food and agriculture. (Source: ITPGRFA, Art. 2)",,,
6497,marine genetic resource,Biological diversity,Marine and Freshwater,,,MGR,,,,,,,,,,,,"Marine genetic resources refer to genetic material of marine plant, marine animal, microbial or other origin containing functional units of heredity, which have an actual or potential value. (Source: draft based on CBD, Art. 2)",,,
6072,plant genetic resource,Land and Agriculture,,,,plant genetics,,,,,,,,,,,,"Genetic resources are, according to the CBD living material that includes genes of present and potential value for humans. Plant genetic resources includes all our agricultural crops and even some of their wild relatives because they too often have valuable traits.(Source: Nordgen)","The scientific study of the hereditary material of plants for purposes such as hybridization, improved food resources and increased production. (Source: GEMET/EEN)",,
6251,biotechnology,Biological diversity,Land and Agriculture,,,synthetic biology,,,,,,,,,,,,"A combination of biology and technology. It is used to describe developments in the application of biological organisms for commercial and scientific purposes. So ""bio"" stands for biology and the science of life, and ""tech"" stands for technology, or the tools and techniques that the biotechnologists have in their workbox. Those tools and techniques include microorganisms and a range of methods for manipulating them, such as genetic engineering. (Source: GEMET/WRIGHT)",,,
6239,biosafety,Biological diversity,Land and Agriculture,,,,,,,,,,,,,,,"The combination of knowledge, techniques and equipment used to manage or contain potentially infectious materials or biohazards in the laboratory environment, to reduce or prevent harm to laboratory workers, other persons and the environment. (Source: GEMET -BIOSAF / OHS) ",,,
6240,genetic engineering,Biological diversity,Land and Agriculture,,,,,,,,,,,,,,,"1) The complex of techniques for the production of new genes and the alteration of the structure of the chromosomes to produce effects beneficial to man, in agriculture and medicine. 2) The intentional production of new genes and alteration of genomes by the substitution or addition of new genetic material. (Source: GEMET/ZINZAN / MGH)",,,
6269,genetically modified organism,Biological diversity,Land and Agriculture,,,,,,,,,,,,,,,An organism that has undergone external processes by which its basic set of genes has been altered. (Source: LEE) ,"In everyday usage LMOs are usually considered to be the same as GMOs (Genetically Modified Organisms), but definitions and interpretations of the term GMO vary widely (CBD FAQs Cartagena Protocol)",,
6286,living modified organism,Biological diversity,Land and Agriculture,,,LMO,,,,,,,,,,,,"Any living organism that possesses a novel combination of genetic material obtained through the use of modern biotechnology. (Source: Biosafety Protocol, Article 3 paragraph g Cartagena Protocol)",,,
6179,capacity building,Land and Agriculture,Environmental Governance,,,capacity development,education,training,,,,,,,,,,"A fundamental goal of capacity building is to enhance the ability to evaluate and address
the crucial questions related to policy choices and modes of implementation among
development options, based on an understanding of environmental potentials and
limits and of needs as perceived by the people of the country concerned. As a result, the need
to strengthen national capacities is shared by all countries (Source: Capacity Building for Sustainable Development, UNEP, 2002 - chapter 37, Agenda 21)","Capacity Building comprises educational and training programmes and materials as well as training and education of scientific, technical and managerial personnel, including strengthening of national institutions (Source: based on UNFCCC Art. 6)",,
6224,best practice,Environmental Governance,,,,BAT,BEP,best available practice,best available technology,best environmental practices,best technique,best available technique,lessons learned,best use,good practice,best science,technicaly justified,"Best available, environmentally effective and economically appropriate techniques and practices. (Source: InforMEA)","Measures, methods or activities that perform best or achieve the highest impact according to predefined criteria assessed through a validation process. Best practices are measures, methods or activities that are considered successful in terms of achieving desired outcomes (good performance) and contributing to expected impacts. (Source: draft based on UNCCD)",,
6397,technology,Climate and Atmosphere,Land and Agriculture,Environmental Governance,Environmental Governance,,,,,,,,,,,,,Systematic knowledge of and its application to industrial processes; closely related to engineering and science. (Source: GEMET/MGH) /n,"The usage and knowledge of tools, techniques, crafts, systems or methods in order to solve a problem or serve some purpose. In the context of environment, technology plays a crucial role together with science in tackling environmental challenges and implementing innovative solutions. (Source: InforMEA)",,
